"domain","question","answer"
"Admissions & Registrations","What is the admission procedure?","Admission to B.Tech is through AP EAPCET convener quota (70%) and B-Category management quota (30%). Please check the college website for notification dates."
"Admissions & Registrations","What are the eligibility criteria for B.Tech?","Candidates must have passed 10+2 with Mathematics, Physics, and Chemistry. For convener quota, a valid EAPCET rank is required."
"Admissions & Registrations","Do you accept lateral entry?","Yes, lateral entry for Diploma holders into the 2nd year of B.Tech is available through the ECET exam."
"Admissions & Registrations","What documents are required for counseling?","You need your EAPCET rank card, hall ticket, 10th & 12th marks memos, transfer certificate (TC), study certificates (6th to 12th), and income/caste certificates if applicable."
"Admissions & Registrations","Is there a management quota?","Yes, 30% of seats are reserved for Category-B (Management) quota. Admissions are based on JEE Main / EAPCET rank or 10+2 merit."
"Financial Matters","What is the tuition fee for B.Tech?","The tuition fee is approximately ₹69,400 per annum for Convener quota and may vary for Management quota. Please verify with the accounts section for the latest figures."
"Financial Matters","What is the hostel fee?","The hostel fee is around ₹45,000 - ₹50,000 per year, including mess charges. It is payable at the beginning of the academic year."
"Financial Matters","Are scholarships available?","Yes, eligible students can apply for Jagananna Vidya Deevena (fee reimbursement) and Vasathi Deevena. Merit scholarships are also available."
"Financial Matters","What is the refund policy for cancellation?","Refunds are processed as per APSCHE and AICTE norms. If a seat is cancelled before the cutoff date, a processing fee is deducted."
"Financial Matters","How do I pay the college fee?","Fees can be paid online via the college student portal or through a Demand Draft (DD) in favor of the Principal."
"Academic Affairs","Which branches are offered in B.Tech?","We offer CSE, ECE, EEE, IT, Mechanical, Civil, Chemical, CSBS, AI&DS, AI&ML, and IoT."
"Academic Affairs","What is the course structure?","The B.Tech program follows a 4-year semester system (8 semesters) with core subjects, electives, labs, and project work as per the autonomous curriculum."
"Academic Affairs","Where can I find the academic calendar?","The academic calendar is available on the college website under the 'Academics' section and on department notice boards."
"Academic Affairs","What are the exam regulations?","We follow a credit-based grading system. Indiscipline or malpractice in exams attracts strict penalties as per the controller of examinations."
"Academic Affairs","Are there departments for research?","Yes, every major department has research centers recognized by Acharya Nagarjuna University."
"Student Services","How can I get a bonafide certificate?","Submit a request application to the Principal's office or apply through the student online portal. It takes 2-3 working days."
"Student Services","How do I get my original certificates back?","Original certificates submitted during admission are returned after verification or upon completion of the course."
"Student Services","Who do I contact for grievances?","You can approach the Grievance Redressal Cell or submit a complaint online through the college website."
"Student Services","Can I get a transcript?","Yes, transcripts for higher studies can be obtained from the Examination Section by paying the prescribed fee."
"Student Services","Is there a student portal?","Yes, the student portal allows you to check attendance, marks, and pay fees online."
"Campus Life","Is hostel facility available?","Yes, we have separate hostels for boys and girls with secure facilities, Wi-Fi, and hygienic mess."
"Campus Life","Is there college transport?","Yes, the college operates a fleet of buses covering Guntur, Vijayawada, Tenali, Chilakaluripet, and Narasaraopet."
"Campus Life","What sports facilities are there?","We have a large playground for cricket, football, and courts for volleyball, basketball, and badminton, along with an indoor gym."
"Campus Life","Are there student clubs?","Yes, there are technical clubs (CSI, ISTE, IEEE) and cultural clubs (Music, Dance, Literary) that organize regular events."
"Campus Life","Is there a library?","Yes, the central library is fully automated with thousands of volumes, digital resources, and a reading room."
"General Information","What is the name of the college?","R.V.R. & J.C. College of Engineering."
"General Information","Where is the college located?","The college is located at Chowdavaram, Guntur, Andhra Pradesh - 522019."
"General Information","Is the college autonomous?","Yes, the college was granted Autonomous status by UGC."
"General Information","Is the college accredited?","Yes, it is accredited by NBA and NAAC with an 'A+' grade."
"General Information","How can I contact the college?","You can call the office at 0863-2288201 or email principal@rvrjc.ac.in."
"Cross-Domain Queries","What are the placement statistics?","We have an excellent placement record with over 1000+ offers this year. Top recruiters include TCS, Infosys, Wipro, CTS, and Amazon."
"Cross-Domain Queries","Do you offer internships?","Yes, students are encouraged to do internships in the 3rd and 4th years. The T&P cell assists in finding opportunities."
"Cross-Domain Queries","Are there industry tie-ups?","We have MOUs with several industries for training, internships, and collaborative research."
"Cross-Domain Queries","Does the college support startups?","Yes, the Entrepreneurship Development Cell (EDC) supports student startups and innovation ideas."
"Cross-Domain Queries","What is the highest package offered?","The highest package offered recently was around 44 LPA by Amazon."
